{"coverage_scope":"synthetic-mechanics-only","exclusion_policy":"none","kind":"meetingrelay-asr-quality-run-policy-v1","max_attempts":1,"quality_gate_status":"not-assessed","required_slices":[{"language":"en","scenario":"synthetic-non-speech","tier":"tier-1"},{"language":"ja","scenario":"synthetic-non-speech","tier":"tier-1"},{"language":"zh","scenario":"synthetic-non-speech","tier":"tier-1"}],"schema_version":"1.0"}
